{"acceptedSchemas":{"armedSnapshot":"ibex/capsec-armed/1","canonicalPolicy":"ibex/capsec-policy/2","capabilityDefinitions":"ibex/capsec-definitions/1","policyRules":"ibex/capsec-rules/1"},"definitions":[{"channels":{"dynamic":true,"handle":false,"synthesis":false},"globality":"shared-process-read","id":"clipboard:read","lifecycle":"authorable","normalizationProfile":"clipboard.v1","occurrenceSchema":"ibex/capsec-occurrence/1","resourceKinds":["clipboard"],"selectorSchema":"ibex/capsec-selector/1","staticOnly":false},{"channels":{"dynamic":true,"handle":false,"synthesis":false},"globality":"shared-process-mutation","id":"clipboard:write","lifecycle":"authorable","normalizationProfile":"clipboard.v1","occurrenceSchema":"ibex/capsec-occurrence/1","resourceKinds":["clipboard"],"selectorSchema":"ibex/capsec-selector/1","staticOnly":false},{"channels":{"dynamic":true,"handle":true,"synthesis":false},"globality":"resource","id":"device:camera","lifecycle":"authorable","normalizationProfile":"camera.v1","occurrenceSchema":"ibex/capsec-occurrence/1","resourceKinds":["camera"],"selectorSchema":"ibex/capsec-selector/1","staticOnly":false},{"channels":{"dynamic":true,"handle":true,"synthesis":false},"globality":"resource","id":"device:location","lifecycle":"authorable","normalizationProfile":"device.location.v1","occurrenceSchema":"ibex/capsec-occurrence/1","resourceKinds":["device-location"],"selectorSchema":"ibex/capsec-selector/1","staticOnly":false},{"channels":{"dynamic":true,"handle":true,"synthesis":false},"globality":"resource","id":"device:microphone","lifecycle":"authorable","normalizationProfile":"microphone.v1","occurrenceSchema":"ibex/capsec-occurrence/1","resourceKinds":["microphone"],"selectorSchema":"ibex/capsec-selector/1","staticOnly":false},{"channels":{"dynamic":false,"handle":false,"synthesis":false},"globality":"shared-process-mutation","id":"env:process-write","lifecycle":"deny-only","normalizationProfile":"closed.surface.v1","occurrenceSchema":"ibex/capsec-occurrence/1","resourceKinds":["closed-surface"],"selectorConstraints":{"closedSurfaceClasses":["process-environment"]},"selectorSchema":"ibex/capsec-selector/1","staticOnly":true},{"channels":{"dynamic":true,"handle":false,"synthesis":false},"globality":"resource","id":"env:read","lifecycle":"authorable","normalizationProfile":"environment.name.v1","occurrenceSchema":"ibex/capsec-occurrence/1","resourceKinds":["environment-name"],"selectorConstraints":{"environmentTargets":["broker-base","principal-overlay"]},"selectorSchema":"ibex/capsec-selector/1","staticOnly":false},{"channels":{"dynamic":true,"handle":false,"synthesis":false},"globality":"resource","id":"env:write","lifecycle":"authorable","normalizationProfile":"environment.name.v1","occurrenceSchema":"ibex/capsec-occurrence/1","resourceKinds":["environment-name"],"selectorConstraints":{"environmentTargets":["child-launch","principal-overlay"]},"selectorSchema":"ibex/capsec-selector/1","staticOnly":false},{"channels":{"dynamic":false,"handle":false,"synthesis":false},"globality":"terminal","id":"ffi:load","lifecycle":"deny-only","normalizationProfile":"closed.surface.v1","occurrenceSchema":"ibex/capsec-occurrence/1","resourceKinds":["closed-surface"],"selectorConstraints":{"closedSurfaceClasses":["ffi"]},"selectorSchema":"ibex/capsec-selector/1","staticOnly":true},{"channels":{"dynamic":true,"handle":true,"synthesis":true},"globality":"resource","id":"fs:list","lifecycle":"authorable","normalizationProfile":"fs.path.v1","occurrenceSchema":"ibex/capsec-occurrence/1","resourceKinds":["path-exact","path-tree"],"selectorSchema":"ibex/capsec-selector/1","staticOnly":false},{"channels":{"dynamic":true,"handle":true,"synthesis":true},"globality":"resource","id":"fs:read","lifecycle":"authorable","normalizationProfile":"fs.path.v1","occurrenceSchema":"ibex/capsec-occurrence/1","resourceKinds":["path-exact","path-tree"],"selectorSchema":"ibex/capsec-selector/1","staticOnly":false},{"channels":{"dynamic":false,"handle":false,"synthesis":false},"globality":"terminal","id":"fs:unbound-mutation","lifecycle":"deny-only","normalizationProfile":"closed.surface.v1","occurrenceSchema":"ibex/capsec-occurrence/1","resourceKinds":["closed-surface"],"selectorConstraints":{"closedSurfaceClasses":["filesystem-unbound-mutation"]},"selectorSchema":"ibex/capsec-selector/1","staticOnly":true},{"channels":{"dynamic":false,"handle":false,"synthesis":false},"globality":"terminal","id":"fs:unbound-read","lifecycle":"deny-only","normalizationProfile":"closed.surface.v1","occurrenceSchema":"ibex/capsec-occurrence/1","resourceKinds":["closed-surface"],"selectorConstraints":{"closedSurfaceClasses":["filesystem-unbound-read"]},"selectorSchema":"ibex/capsec-selector/1","staticOnly":true},{"channels":{"dynamic":true,"handle":true,"synthesis":false},"globality":"resource","id":"fs:watch","lifecycle":"authorable","normalizationProfile":"fs.path.v1","occurrenceSchema":"ibex/capsec-occurrence/1","resourceKinds":["path-exact","path-tree"],"selectorSchema":"ibex/capsec-selector/1","staticOnly":false},{"channels":{"dynamic":true,"handle":true,"synthesis":false},"globality":"resource","id":"fs:write","lifecycle":"authorable","normalizationProfile":"fs.path.v1","occurrenceSchema":"ibex/capsec-occurrence/1","resourceKinds":["path-exact","path-tree"],"selectorSchema":"ibex/capsec-selector/1","staticOnly":false},{"channels":{"dynamic":false,"handle":false,"synthesis":false},"globality":"terminal","id":"inspector:activate","lifecycle":"deny-only","normalizationProfile":"closed.surface.v1","occurrenceSchema":"ibex/capsec-occurrence/1","resourceKinds":["closed-surface"],"selectorConstraints":{"closedSurfaceClasses":["inspector"]},"selectorSchema":"ibex/capsec-selector/1","staticOnly":true},{"channels":{"dynamic":false,"handle":false,"synthesis":false},"globality":"shared-process-mutation","id":"ipc:channel","lifecycle":"deny-only","normalizationProfile":"closed.surface.v1","occurrenceSchema":"ibex/capsec-occurrence/1","resourceKinds":["closed-surface"],"selectorConstraints":{"closedSurfaceClasses":["ipc"]},"selectorSchema":"ibex/capsec-selector/1","staticOnly":true},{"channels":{"dynamic":false,"handle":false,"synthesis":false},"globality":"shared-process-mutation","id":"lifecycle:exit","lifecycle":"authorable","normalizationProfile":"lifecycle.exit.v1","occurrenceSchema":"ibex/capsec-occurrence/1","resourceKinds":["session-lifecycle"],"selectorSchema":"ibex/capsec-selector/1","staticOnly":false},{"channels":{"dynamic":true,"handle":true,"synthesis":false},"globality":"resource","id":"network:connect","lifecycle":"authorable","normalizationProfile":"network.connect.v1","occurrenceSchema":"ibex/capsec-occurrence/1","resourceKinds":["connect-endpoint","connect-unix"],"selectorSchema":"ibex/capsec-selector/1","staticOnly":false},{"channels":{"dynamic":true,"handle":true,"synthesis":false},"globality":"resource","id":"network:fetch","lifecycle":"authorable","normalizationProfile":"network.fetch.v1","occurrenceSchema":"ibex/capsec-occurrence/1","resourceKinds":["fetch-endpoint"],"selectorSchema":"ibex/capsec-selector/1","staticOnly":false},{"channels":{"dynamic":true,"handle":true,"synthesis":false},"globality":"resource","id":"network:listen","lifecycle":"authorable","normalizationProfile":"network.listen.v1","occurrenceSchema":"ibex/capsec-occurrence/1","resourceKinds":["listen-inet","listen-unix"],"selectorSchema":"ibex/capsec-selector/1","staticOnly":false},{"channels":{"dynamic":true,"handle":false,"synthesis":false},"globality":"resource","id":"network:resolve","lifecycle":"authorable","normalizationProfile":"network.resolve.v1","occurrenceSchema":"ibex/capsec-occurrence/1","resourceKinds":["dns-query"],"selectorSchema":"ibex/capsec-selector/1","staticOnly":false},{"channels":{"dynamic":false,"handle":false,"synthesis":false},"globality":"session-scoped","id":"path:cwd-mutate","lifecycle":"authorable","normalizationProfile":"path.cwd.v1","occurrenceSchema":"ibex/capsec-occurrence/1","resourceKinds":["path-exact"],"selectorSchema":"ibex/capsec-selector/1","staticOnly":true},{"channels":{"dynamic":false,"handle":false,"synthesis":false},"globality":"session-scoped","id":"path:cwd-observe","lifecycle":"authorable","normalizationProfile":"path.cwd.v1","occurrenceSchema":"ibex/capsec-occurrence/1","resourceKinds":["session-state"],"selectorSchema":"ibex/capsec-selector/1","staticOnly":true},{"channels":{"dynamic":false,"handle":false,"synthesis":false},"globality":"shared-process-mutation","id":"process:identity","lifecycle":"deny-only","normalizationProfile":"closed.surface.v1","occurrenceSchema":"ibex/capsec-occurrence/1","resourceKinds":["closed-surface"],"selectorConstraints":{"closedSurfaceClasses":["process-identity"]},"selectorSchema":"ibex/capsec-selector/1","staticOnly":true},{"channels":{"dynamic":false,"handle":false,"synthesis":false},"globality":"shared-process-mutation","id":"process:limit","lifecycle":"deny-only","normalizationProfile":"closed.surface.v1","occurrenceSchema":"ibex/capsec-occurrence/1","resourceKinds":["closed-surface"],"selectorConstraints":{"closedSurfaceClasses":["process-limit"]},"selectorSchema":"ibex/capsec-selector/1","staticOnly":true},{"channels":{"dynamic":false,"handle":false,"synthesis":false},"globality":"shared-process-mutation","id":"process:priority","lifecycle":"deny-only","normalizationProfile":"closed.surface.v1","occurrenceSchema":"ibex/capsec-occurrence/1","resourceKinds":["closed-surface"],"selectorConstraints":{"closedSurfaceClasses":["process-priority"]},"selectorSchema":"ibex/capsec-selector/1","staticOnly":true},{"channels":{"dynamic":false,"handle":false,"synthesis":false},"globality":"shared-process-mutation","id":"process:signal","lifecycle":"deny-only","normalizationProfile":"closed.surface.v1","occurrenceSchema":"ibex/capsec-occurrence/1","resourceKinds":["closed-surface"],"selectorConstraints":{"closedSurfaceClasses":["process-signal"]},"selectorSchema":"ibex/capsec-selector/1","stati